{
  "profileId": "ubuntu-gnome",
  "schemaVersion": "0.1",
  "description": "Binding intents for ubuntu-gnome; authoritative dispatch lives in Core UCI / Shell as implemented.",
  "primaryInput": "keyboard",
  "secondaryInput": ["controller"],
  "keyboard": {
    "commandPalette": {
      "open": ["Ctrl+Shift+P", "Super+Period"],
      "note": "Universal command surface; must not require browser."
    },
    "navigation": {
      "focusNextPanel": "Ctrl+Tab",
      "focusPreviousPanel": "Ctrl+Shift+Tab",
      "toggleThinUIFullscreen": "F11"
    },
    "thinui": {
      "escapeToHost": "Escape",
      "note": "Long-press or chord TBD for GNOME handoff without conflicting with app focus."
    }
  },
  "controller": {
    "enabled": true,
    "uciAlignment": "radial-and-actions-contract",
    "note": "Maps to family UCI modes when host stack exposes controller input; no duplicate semantics in ThinUI."
  }
}
